[{"context_type":"Course","course_id":"58000","plannable_id":"1290002","planner_override":null,"plannable_type":"assignment","new_activity":false,"submissions":{"submitted":false,"excused":false,"graded":false,"posted_at":null,"late":false,"missing":false,"needs_grading":false,"has_feedback":false,"redo_request":false},"plannable_date":"2026-10-02T04:59:59Z","plannable":{"id":"1290002","title":"Task 3","created_at":"2026-08-12T00:31:19Z","updated_at":"2026-08-12T00:31:19Z","points_possible":10.0,"due_at":"2026-10-02T04:59:59Z"},"html_url":"/courses/58000/assignments/1290002","context_name":"Scenario: Planner","context_image":null},{"context_type":"Course","course_id":"58000","plannable_id":"1290003","planner_override":null,"plannable_type":"assignment","new_activity":false,"submissions":{"submitted":false,"excused":false,"graded":false,"posted_at":null,"late":false,"missing":false,"needs_grading":false,"has_feedback":false,"redo_request":false},"plannable_date":"2026-10-03T04:59:59Z","plannable":{"id":"1290003","title":"Task 4","created_at":"2026-08-20T02:05:00Z","updated_at":"2026-08-20T02:05:00Z","points_possible":10.0,"due_at":"2026-10-03T04:59:59Z"},"html_url":"/courses/58000/assignments/1290003","context_name":"Scenario: Planner","context_image":null}]